<?xml version="1.0" encoding="UTF-8"?>
<colori xmlns:xsi="http://www.w3.org/2001/XMLSchema-instance" xsi:noNamespaceSchemaLocation="infostud.xsd">
  <colore>
    <nome>red</nome>
  </colore>
  <colore>
    <nome>yellow</nome>
  </colore>
  <colore>
    <nome>blue</nome>
  </colore>
  <colore>
    <nome>pink</nome>
  </colore>
  <colore>
    <nome>gray</nome>
  </colore>
  <colore>
    <nome>lightgray</nome>
  </colore>
  <colore>
    <nome>lightpink</nome>
  </colore>
  <colore>
    <nome>lightblue</nome>
  </colore>
  <colore>
    <nome>orange</nome>
  </colore>
  <colore>
    <nome>green</nome>
  </colore>
  <colore>
    <nome>aqua</nome>
  </colore>
  <colore>
    <nome>lightgreen</nome>
  </colore>
  <colore>
    <nome>cyan</nome>
  </colore>
  <colore>
    <nome>lightcyan</nome>
  </colore>
  <colore>
    <nome>turquoise</nome>
  </colore>
  <colore>
    <nome>purple</nome>
  </colore>
</colori>